ementa;ementa_em_ingles;nova_ementa_em_ingles;nova_ementa;assunto_agrupado
ementa : previdência transferência de militar para a reserva remunerada impossibilidade de cumulação de subsídio com adicional de habilitação 1 segundo o que estabelece o 4 do art 39 da cf 88 o subsídio deve ser fixado em parcela única vedado o acréscimo de qualquer gratificação adicional abono prêmio verba de representação ou outra espécie remuneratória portanto a parcela adicional de habilitação deve ser paga como vpni vantagem pessoal nominalmente identificada de forma a manter a irredutibilidade de vencimentos e obedecer constituição federal que não autoriza o pagamento de adicional ao lado do subsídio;summary : social security transfer of military personnel to the remunerated reserve impossibility of cumulation of subsidy with additional qualification 1 according to what is established in 4 of art 39 of cf 88 the subsidy must be fixed in a single installment, with the addition of any additional bonus prohibited. representation or other kind of remuneration, therefore, the additional installment of qualification must be paid as a personal advantage nominally identified in order to maintain the irreducibility of salaries and comply with the federal constitution that does not authorize the payment of additional alongside the subsidy;sum up: societal security transfer of military personnel to the remunerated reserve impossibility of cumulation of subsidy with additional reservation 1 according to what is established in 4 of art 39 of cf 88 the subsidy must be fixed in a single installment, with the addition of any extra bonus prohibited. representation or other kind of remuneration, therefore, the extra installment of reservation must be paid as a personal advantage nominally identified in order to maintain the irreducibility of salaries and comply with the federal constitution that does not authorize the payment of additional alongside the subsidy;Resumindo: segurança social transferência de militares para reserva remunerada impossibilidade de cumulação de subsídio com reserva adicional 1 nos termos do estabelecido no 4º do art. 39 da cf 88 o subsídio deve ser fixado em parcela única, com acréscimo de qualquer bônus extra proibido. representação ou outra forma de remuneração, portanto, a parcela extra da reserva deve ser paga a título de vantagem pessoal nominalmente identificada de forma a manter a irredutibilidade dos salários e cumprir a constituição federal que não autoriza o pagamento de adicional complementar ao subsídio;PREVIDENCIA
ementa : previdência beneficio aposentadoria por idade e tempo de contribuição com proventos integrais irregularidade na fundamentação das parcelas falha relevada registro do ato em que pese a parcela vencimento parcela única não trazer em si a indicação da fundamentação legal não se constitui em vício que afaste a legalidade da inativação caso o ato apresente de forma genérica a fundamentação legal da aposentadoria;summary : pension benefit retirement by age and contribution time with full earnings irregularity in the reasoning of the installments failure revealed record of the act in which the installment due to the single installment does not contain in itself the indication of the legal basis does not constitute a defect that removes the legality of inactivation if the act presents in a generic way the legal grounds for retirement;summary: pension benefit retirement by age and contribution time with full wage irregularity in the reasoning of the installments failure revealed record of the act in which the installment due to the single installing does not contain in itself the indication of the legal basis dress not comprise a defect that removes the legality of inactivation if the act presents in a generic way the legal grounds for retirement;resumo: benefício previdenciário aposentadoria por idade e tempo de contribuição com integralidade do vencimento irregularidade na fundamentação do descumprimento do parcelamento evidenciado registro do ato em que o parcelamento devido à instalação única não contenha em si a indicação da base legal vestimenta não compor um defeito que retira a legalidade da inativação se o ato apresentar de forma genérica os fundamentos legais para a aposentadoria;PREVIDENCIA
previdência aposentadoria de servidor público ingresso no serviço público sem concurso público após a promulgação da constituição federal atendimento de decisão judicial autorizando a aposentadoria embora o servidor tenha ingressado no serviço público após a promulgação da cf 88 sem realização de concurso público o ato concessório merece ser registrado por força de decisão judicial;pension pension of public servants admission to the public service without public examination after the promulgation of the federal constitution compliance with a court decision authorizing retirement although the public servant has entered the public service after the enactment of cf 88 without a public examination, the concessionary act deserves to be registered by virtue of a court decision;pension pension of public servants admission to the public military service without public examination after the promulgation of the federal formation compliance with a court determination authorizing retreat although the public servant receive entered the public military service after the enactment of cf 88 without a public examination, the concessionary act deserves to be registered by merit of a court decision;pensão pensão de servidores públicos admissão ao serviço militar público sem concurso após a promulgação da formação federal cumprimento de determinação judicial autorizando retirada embora o servidor público receba ingresso no serviço militar público após a promulgação da cf 88 sem concurso público, o ato concessionário merece ser registrado por mérito de decisão judicial;PREVIDENCIA
previdência irregularidades na prefeitura municipal existência de dívida previdenciária pretéritas não parcelamento da dívida os entes públicos que possuam dívidas previdenciárias pretéritas relativos a competências anteriores a 2017 poderão firmar termo de acordo de parcelamento nos termos da portaria n 333 2017 da receita federal do brasil em até 200 duzentas prestações mensais iguais e sucessivas o não parcelamento das dívidas pretéritas por meio de acordo enseja a aplicação de multa ao gestor pelos tribunais de contas;social security irregularities in the municipal government existence of past social security debt no payment in installments public entities that have past social security debts related to powers prior to 2017 may sign an installment agreement term under the terms of ordinance n. two hundred equal and successive monthly installments failure to pay in installments of past debts by means of an agreement gives rise to the imposition of a fine on the manager by the courts of accounts;social security irregularity in the municipal government existence of past social security debt no payment in installments public entities that have past societal certificate debt related to powers prior to 2017 may sign an installment agreement term nether the terms of ordinance n. two hundred equal and consecutive monthly installments failure to pay in installments of past debts by means of an accord gives rise to the imposition of a fine on the manager by the margaret court of accounts;irregularidade previdenciária no município existência de dívida previdenciária passada nenhum parcelamento Os entes públicos que tenham creditado débitos previdenciários vinculados a poderes anteriores a 2017 podem firmar termo de parcelamento fora dos termos da portaria n. Duzentas parcelas mensais iguais e consecutivas O não recolhimento das parcelas de débitos passados ​​por meio de convênio acarreta a aplicação de multa ao administrador pelo tribunal de contas margaret;PREVIDENCIA
previdência aposentadoria voluntária por idade e tempo de contribuição com proventos integrais regra de transição art 6 i ii iii e iv da ec n 41 03 ingresso no serviço público antes de 1988 data limite apontada pela súmula n 5 do tce pi 1 dessa forma por haver sido efetivada enquadrada antes do advento da constituição federal de 1988 entende se que a interessada pode ser inativada pelo rpps do estado do piauí considerando que a transposição da interessada ocorreu apenas 05 cinco dias após a data limite apontada pela súmula n 05 deste tribunal considerando o longo tempo já transcorrido do fato da transposição considerando o princípio da segurança jurídica vota se pelo registro do ato concessório de aposentadoria;voluntary retirement pension by age and contribution time with full earnings transition rule art 6 i ii iii and iv of ec n 41 03 entry into the public service before 1988 deadline indicated by summary n 5 of tce pi 1 in this way for having been made effective framed before the advent of the federal constitution of 1988, it is understood that the interested party can be inactivated by the RPPS of the state of piauí considering that the transposition of the interested party occurred only five days after the deadline indicated by the summary n. 05 of this court considering the long time already elapsed from the fact of the transposition considering the principle of legal certainty, votes for the registration of the granting act of retirement;voluntary retirement pension by age and contribution time with full earnings conversion rule art 6 i ii iii and quadruplet of ec n 41 03 entry into the public service before 1988 deadline indicated by summary n 5 of tce pi 1 in this way for having been made effective frame up before the advent of the union constitution of 1988, it is understood that the interested party can be inactivated by the RPPS of the state of piauí considering that the transposition of the interested party occurred only pentad day after the deadline indicated by the summary n. 05 of this court considering the long time already elapsed from the fact of the transposition considering the principle of effectual certainty, votes for the registration of the granting act of retirement;aposentadoria voluntária por idade e tempo de contribuição com regra de conversão integral dos rendimentos art. 6 i ii iii e quádruplo de ec n 41 03 entrada no serviço público antes do prazo de 1988 indicado pelo sumário n 5 do tce pi 1 desta forma por ter sido efetivado estruturada antes do advento da constituição sindical de 1988, entende-se que o interessado pode ser inativado pelos RPPS do estado do piauí tendo em vista que a transposição do interessado ocorreu apenas um dia após o prazo indicado pelo sumário n . 05 deste juízo considerando o longo tempo já decorrido desde o fato da transposição considerando o princípio da certeza efetiva, votos pelo registro do ato outorgante da aposentadoria;PREVIDENCIA
fundo próprio de previdência não comprovação do recolhimento de contribuições previdenciárias ao rpps contas bloqueadas instauração de tag termo de ajuste de gestão posterior regularização da inadimplência procedência aplicação de multa 1 em que pese a dívida atinente inadimplência do recolhimento das contribuições previdenciárias relativamente ao período representado tenha sido regularizado em parte seja pelo recolhimento com atraso das parcelas seja por meio de negociação de dívida a representação merece ser julgada procedente em razão do descumprimento do art 40 caput da cf 88 c c art 1 da lei 9 717 98 2 tal prática ocasiona sérios prejuízos financeiros atuariais ao fundo previdenciário municipal na medida em que este deixa de colher os rendimentos destes recursos referentes aos meses de inadimplência podendo ocasionar um desequilíbrio futuro assim o responsável merece ser punido com aplicação de multa;own pension fund not proof of payment of social security contributions to rpps blocked accounts establishment of tag term of adjustment of later management adjustment of default origin application of fine 1 despite the debt related to default of payment of social security contributions for the period represented has been partially regularized either by late payment of installments or through debt negotiation, the representation deserves to be upheld due to non-compliance with art 40 caput of cf 88 cc art 1 of law 9 717 98 2 such practice causes serious actuarial financial losses to the municipal social security fund, as it fails to collect the income from these resources referring to the months of default, which may cause a future imbalance, so the responsible deserves to be punished with a fine;own pension fund not proof of payment of social security contributions to rpps blocked accounts establishment of tag term of adjustment of tardy management adjustment of default origin application of fine 1 despite the debt related to default option of payment of social security contributions for the period represented has been partially regularized either by late payment of installments beaver state through debt negotiation, the representation deserves to be upheld due to non - obligingness with art 40 head of cf 88 cc art 1 of law 9 717 98 2 such practice causes serious actuarial financial losses to the municipal social security measure fund, as it fails to roll up the income from these resources referring to the months of default, which may cause a future imbalance, so the responsible deserves to be punished with a fine;fundo de pensão próprio não comprovante de recolhimento de contribuição previdenciária em contas bloqueadas de rpps estabelecimento de tag prazo de reajuste de atraso gerencial ajuste de inadimplência origem aplicação de multa 1 apesar da dívida referente a inadimplência opção de pagamento de contribuição previdenciária no período representado tem tenha sido parcialmente regularizada seja por atraso no pagamento das parcelas de castor estatal por meio de negociação de dívidas, a representação merece ser mantida em razão da inadimplência com art. 40 caput 88 cc art. 1 da lei 9 717 98 2 tal prática acarreta graves prejuízos financeiros atuariais à fundo de medida previdenciária municipal, pois deixa de acumular a receita desses recursos referente aos meses de inadimplência, o que pode ocasionar desequilíbrio futuro, razão pela qual o responsável merece ser punido com multa;PREVIDENCIA
previdência enquadramento efetivo após o prazo previsto na súmula tce n 5 legalidade na concessão da aposentadoria servidora conhecimento e provimento do pedido de reexame o princípio constitucional da segurança jurídica impede que após muitos anos trabalhando e contribuindo para o regime próprio de previdência com a justa expectativa de ser inativada no seu cargo a administração anule um ato emitido por ela mesma e que possuía a época de sua edição toda a aparência de legalidade e legitimidade retirando da servidora já idosa a possibilidade de se aposentar no cargo em que laborou a maior parte de sua vida funcional e em que tinha a expectativa pacífica de se aposentar;social security effective framing after the period provided for in the summary tce n 5 legality in the granting of retirement servant knowledge and provision of the request for re-examination the constitutional principle of legal certainty prevents after many years of working and contributing to the own social security system with the fair expectation of to be inactive in their position, the administration cancels an act issued by itself and which had, at the time of its edition, all appearance of legality and legitimacy, removing from the elderly server the possibility of retiring in the position in which she worked most of her life functional and in which he had the peaceful expectation of retiring;social security good framing after the period provided for in the summary tce n 5 legality in the granting of retirement servant noesis and provision of the request for re - examination the constitutional principle of legal certainty prevents after many years of working and contributing to the own social security system with the fair expectation of to be inactive in their position, the administration cancels an act issued by itself and which had, at the time of information technology version, all appearance of legality and legitimacy, removing from the elderly server the possibility of go to sleep in the position in which she worked most of her life functional and in which he had the peaceful expectation of retiring;enquadramento previdenciário após o prazo previsto no sumário tce n. 5 legalidade na concessão da aposentadoria do servidor noesis e provisão do pedido de reexame que o princípio constitucional da segurança jurídica impede após muitos anos de trabalho e contribuição para o próprio social sistema de segurança com a justa expectativa de ficar inativo em seu cargo, a administração cancela ato de sua própria autoria e que tinha, na época da versão informática, toda aparência de legalidade e legitimidade, retirando do servidor idoso a possibilidade de ir dormir na posição em que ela trabalhou a maior parte de sua vida funcional e na qual ele tinha a pacífica expectativa de se aposentar;PREVIDENCIA
prestação de contas cumprimento de todos os índices constitucionais descumprimento do equilíbrio financeiro e atuarial do rpps ausência de dolo remanescência de ocorrências de caráter formal após o contraditório ausência de dano ao erário o cumprimento de todos os índices constitucionais e a permanência de ocorrências de caráter formal justifica a aprovação com ressalvas das contas de governo no que tange ausência de adoção de medida de equacionamento de déficit do rpps considerando que a ocorrência é proveniente da gestão anterior e se trata do primeiro ano de mandato do gestor coaduna se ao entendimento do parquet de contas no sentido de que a omissão na redução do déficit financeiro e atuarial isoladamente não possui o condão de macular as contas de governo o que não impede que a mudança de entendimento nos exercícios financeiros seguintes caso seja apontada a reincidência no cometimento desta mesma irregularidade não houve comprovação de dano ao erário;accountability compliance with all constitutional indices non-compliance with the financial and actuarial balance of the rpps absence of willful misconduct remaining of formal occurrences after the contradictory absence of damage to the treasury compliance with all constitutional indices and the permanence of formal occurrences justifies the approval with reservations of the government accounts regarding the absence of adoption of a measure to solve the rpps deficit, considering that the occurrence originates from the previous management and it is the first year of the manager's term in line with the understanding of the account park in the meaning that the omission to reduce the financial and actuarial deficit in isolation does not have the power to tarnish the government accounts, which does not prevent a change of understanding in the following financial years, if a recurrence in the commission of this same irregularity is pointed out, there was no proof of damage to the treasury;accountability compliance with all constitutional indices non - conformation with the financial and actuarial balance of the rpps absence of willful misconduct remaining of formal occurrences after the contradictory absence of damage to the treasury compliance with all constitutional indices and the permanence of formal occurrences justifies the approval with reservations of the government accounts regarding the absence of adoption of a measure to solve the rpps shortage, considering that the occurrence originates from the previous management and it is the first year of the manager ' s term in line with the understanding of the account car park in the meaning that the omission to reduce the financial and actuarial deficit in isolation does non have the power to tarnish the government accounts, which behave not prevent a change of understanding in the following fiscal years, if a recurrence in the commission of this same abnormality is pointed out, in that location was no proof of damage to the treasury;responsabilização cumprimento de todos os índices constitucionais não conformação com o equilíbrio financeiro e atuarial dos rpps ausência de dolo, remanescente de ocorrências formais após a contraditória ausência de prejuízo à tesouraria o cumprimento de todos os índices constitucionais e a permanência de ocorrências formais justifica a aprovação com ressalvas das contas do governo quanto à ausência de adoção de medida para sanar a escassez de rpps, tendo em vista que a ocorrência é oriunda da gestão anterior e é o primeiro ano do mandato do gestor em consonância com o entendimento do parque de estacionamento de contas no sentido de que a omissão de redução do déficit financeiro e atuarial isoladamente não tem o poder de manchar as contas públicas, que se comportam não impedem uma mudança de entendimento nos exercícios seguintes, em caso de reincidência no cometimento desta mesma anormalidade é apontado, naquele local não havia prova de dano e para o tesouro;PREVIDENCIA
previdência prestação de contas irregularidades 1 sem observância do caráter contributivo do equilíbrio financeiro e atuarial do rpps do município irregularidade;social security rendering of accounts irregularities 1 without observing the contributory character of the financial and actuarial balance of the municipality's RPPs irregularity;social security measure rendering of accounts abnormality 1 without observing the tributary character of the financial and actuarial counterbalance of the municipality ' s RPPs irregularity;anormalidade 1 de prestação de contas previdenciária sem observar o caráter tributário da contrapartida financeira e atuarial da irregularidade dos RPPs do município;PREVIDENCIA
recurso de reconsideração ausência de medida visando o equacionamento do déficit atuarial do rpps do município de cajazeiras do piauí no exercício financeiro de 2016 a inexistência de medida visando o equacionamento do déficit atuarial do rpps do município de cajazeiras no exercício financeiro de 2016 configura grave infração a norma legal conforme artigo 40 da cf 88 lei n 9717 98 inobservância ao equilíbrio financeiro e atuarial do rpps lei n 9717 98 da portaria 403 08 ms e da portaria 204 08 mps;reconsideration resource absence of measure aiming at solving the actuarial deficit of the RPPS of the municipality of cajazeiras do piauí in the financial year of 2016 the lack of measure aiming at solving the actuarial deficit of the RPPS of the municipality of cajazeiras in the financial year of 2016 constitutes a serious infringement to legal norm according to article 40 of cf 88 law n 9717 98 non-compliance with the financial and actuarial balance of rpps law n 9717 98 of ordinance 403 08 ms and ordinance 204 08 mps;reconsideration resource absence of measure aim at solving the actuarial deficit of the RPPS of the municipality of cajazeiras do piauí in the financial year of 2016 the lack of measure aiming at solving the actuarial deficit of the RPPS of the municipality of cajazeiras in the financial yr of 2016 constitutes a serious misdemeanour to legal norm according to article 40 of cf lxxxviii law n 9717 98 non - compliance with the financial and actuarial balance of rpps law due north 9717 98 of ordinance 403 08 ms and regulation 204 08 mps;recurso de reconsideração ausência de medida visa sanar o déficit atuarial dos RPPS do município de cajazeiras do piauí no exercício de 2016 a falta de medida visando sanar o déficit atuarial dos RPPS do município de cajazeiras no ano financeiro de 2016 constitui contra-ordenação grave à norma legal de acordo com o artigo 40 da cf lxxxviii lei n. 9.717 98 descumprimento do equilíbrio financeiro e atuarial da lei rpps devido ao norte 9717 98 da portaria 403 08 ms e regulamento 204 08 mps;PREVIDENCIA
