ementa;ementa_em_ingles;nova_ementa_em_ingles;nova_ementa;assunto_agrupado
prestação de contas prefeitura municipal de simplício mendes contas do fms exercício 2015 ausência de procedimento licitatório para a contratação do serviço de exame laboratorial contratações por tempo determinado de forma irregular 1 analisando a documentação enviada acerca da tomada de preço n 022 2013 percebe se que o sr adriano martins ferreira nomeado pra exercer o cargo de chefe de gabinete do secretário da secretaria municipal de saúde do município de simplício mendes em 01 02 2013 conforme portaria em anexo peça 19 fl 176 também é sócio de uma das empresas vencedoras do referido certame 2 conforme o art 9 inc iii da lei n o 8 666 93 não poderá participar direta ou indiretamente da licitação ou da execução de obra ou serviço e do fornecimento de bens a eles necessários servidor ou dirigente de órgão ou entidade contratante ou responsável pela licitação de forma que se entende que também é proibida a participação de empresas cujos sócios sejam servidores ou dirigentes dos órgãos contratantes em respeito ao princípio da moralidade administrativa 3 no tocante contratação por tempo determinado a defesa não enviou qualquer documento que comprovasse a realização de processo seletivo para a regular contratação por tempo determinado de forma a atender necessidade temporária de excepcional interesse público mediante autorização legislativa conforme determina a constituição federal em seu art 37 inciso ix;accountability municipal prefecture of simplício mendes fms accounts fiscal year 2015 absence of bidding procedure for hiring the laboratory examination service irregularly fixed-term contracts 1 analyzing the documentation sent about the price taking n 022 2013 it is clear that you adriano martins ferreira appointed to hold the position of chief of staff of the secretary of the municipal health secretariat of the municipality of simplício mendes on 01 02 2013 as per the attached ordinance part 19 fl 176 is also a partner of one of the winning companies of the aforementioned event 2 as per the art 9 inc iii of law no. 8 666 93 may not participate directly or indirectly in the bidding or in the execution of a work or service and in the supply of goods necessary for them, a servant or manager of a contracting agency or entity or responsible for the bidding in a manner that is understood that the participation of companies whose partners are servants or directors of the bodies is also prohibited. contracting parties in respect of the principle of administrative morality 3 regarding contracting for a fixed period, the defense did not send any document that proves the performance of a selective process for regular contracting for a fixed period in order to meet the temporary need of exceptional public interest by means of legislative authorization as determined the federal constitution in its art 37 item ix;accountability municipal prefecture of simplício mendes fms accounts fiscal year 2015 absence of bidding procedure for hiring the laboratory examination service irregularly fixed - term contracts 1 analyzing the documentation sent about the price taking n 022 2013 it is clear that you adriano martins ferreira appointed to hold the posture of chief of staff of the secretary of the municipal health secretariat of the municipality of simplício mendes on 01 02 2013 as per the attached ordinance part 19 fl 176 is likewise a partner of one of the winning companionship of the aforementioned event 2 as per the art 9 inc iii of law no. 8 666 93 may not participate directly or indirectly in the bidding or in the execution of a work or service and in the supply of goods necessary for them, a servant operating theater manager of a contracting agency or entity or responsible for the bidding in a manner that is understood that the participation of companies whose partners are servants or director of the bodies is also prohibited. contracting parties in respect of the principle of administrative ethics 3 regarding contracting for a fixed period, the defending team did not send any document that proves the performance of a selective process for regular catching for a fixed period in order to meet the temporary need of exceptional public interest by means of legislative authorization as determined the federal constitution in its art 37 item ix;prestação de contas prefeitura municipal de simplício mendes contas fms exercício 2015 ausência de procedimento licitatório para contratação de serviço de exames laboratoriais irregularmente fixados - contratos a termo 1 analisando a documentação enviada sobre a tomada de preço n 022 2013 fica claro que o senhor adriano martins ferreira nomeado para realizar o postura de chefe de gabinete do secretário da secretaria municipal de saúde do município de simplício mendes em 01 02 2013 conforme portaria anexa parte 19 fl 176 é igualmente sócio de uma das companheiras vencedoras do referido evento 2 nos termos do art. 9 inc iii da lei no. 8 666 93 não poderá participar direta ou indiretamente da licitação ou da execução de obra ou serviço e do fornecimento de bens que lhes sejam necessários, servo gerente de sala de cirurgia de agência ou entidade contratante ou responsável pela licitação na forma isto é, entendido que também é proibida a participação de empresas cujos sócios sejam servidores ou dirigentes dos órgãos. contratantes no que diz respeito ao princípio da ética administrativa 3 relativamente à contratação por prazo determinado, a equipa defensora não enviou qualquer documento que comprove a realização de processo seletivo de apanha regular por prazo determinado para fazer face à necessidade temporária de excepcional interesse público mediante autorização legislativa conforme determina a constituição federal em seu art. 37 inciso ix;PRESTACAO DE CONTAS
prestação de contas atraso no envio das peças orçamentárias atraso no envio das prestações de contas mensais divergência no balanço financeiro déficit de arrecadação tributária reprovação o art 70 único da constituição federal impõe o dever de prestar contas na forma e no prazo devido assim como o art 33 iv da constituição estadual e resolução tce pi n 905 2009 conferem prerrogativas s cortes de contas para examinar mediante fiscalização o gasto de recursos públicos a não entrega de documentos de prestação de contas constitui grave afronta ao comando constitucional art 70 parágrafo único cf 88 que impõe o dever de prestar contas na forma e no prazo devido e resolução tce n 09 2014 o art 5 da resolução tce pi n 39 2015 determina que os dados eletrônicos deverão apresentar se em inteira conformidade com as informações dos documentos físicos que integram a prestação de contas que permanecerá na sede dos jurisdicionados e na sede da câmara municipal na hipótese em que a arrecadação tributária se mostrar inexpressiva quando comparada com a receita efetiva arrecada necessária a revisão do processo de planejamento público com observância dos princípios técnicos de orçamento art 30 da lei n 4 320 64 e art 12 da lrf;rendering of accounts delay in sending budget documents delay in sending monthly installments of accounts divergence in the balance sheet tax collection deficit disapproval The sole art 70 of the federal constitution imposes the duty to render accounts in the proper form and within the due time, as well as art 33 iv of the state constitution and resolution tce pin n 905 2009 grant prerogatives to the cuts of accounts to examine through inspection the expenditure of public resources. duty to be accountable in the form and within due time and resolution tce n 09 2014 art 5 of the tce pin 39 2015 resolution determines that the electronic data must be presented in full compliance with the information of the physical documents that integrate the rendering of accounts that will remain at the seat of the jurisdictions and at the seat of the city council in the event that the collection taxes would prove inexpressive when compared to the actual revenue collected necessary to review the public planning process with observance of the technical budget principles art 30 of law n. 4 320 64 and art 12 of lrf;rendering of accounts delay in send budget documents delay in sending monthly installments of accounts divergence in the balance sheet tax collection deficit disapproval The sole art 70 of the federal constitution imposes the duty to fork up accounts in the proper form and within the due time, as well as art 33 4 of the state constitution and resolution tce pin n 905 2009 grant prerogatives to the cuts of accounts to examine through inspection the expenditure of public resource. duty to be accountable in the form and within due time and resolution tce n 09 2014 art 5 of the tce pin 39 2015 resolution determines that the electronic data mustiness be gift in full compliance with the information of the physical documents that integrate the interpretation of accounts that will remain at the seat of the jurisdictions and at the seat of the city council in the event that the collection taxes would prove inexpressive when compared to the actual revenue collected necessary to review the public planning process with observance of the technical budget principles art 30 of law n. 4 320 64 and art 12 of lrf;prestação de contas demora no envio de documentos orçamentários demora no envio das parcelas mensais das contas divergência no balanço patrimonial desaprovação do déficit de arrecadação O único art. 70 da constituição federal impõe o dever de desembolsar as contas na forma adequada e no prazo devido, conforme bem como o art. 33 4º da constituição estadual e a resolução tce pin n. 905 2009 outorgam prerrogativas ao corte de contas para examinar, por fiscalização, as despesas de recursos públicos. dever de prestação de contas na forma e no prazo devido e resolução tce n 09 2014 art. 5 da resolução tce pin 39 2015 determina que os dados eletrônicos devem ser doados em total conformidade com as informações dos documentos físicos que integram a interpretação das contas que permanecerá na sede das comarcas e na sede do conselho municipal caso a arrecadação de impostos se mostre inexpressiva quando comparada à receita real arrecadada necessária à revisão do processo de planejamento público com observância dos princípios técnicos orçamentários art. 30 da lei n. 4 320 64 e art. 12 da lrf;PRESTACAO DE CONTAS
prestação de contas gestão irregularidade nas despesas realizadas com recursos de precatórios do fundef pagamento de aposentadorias sem fundo de previdência próprio inadimplência com a eletrobrás denúncias procedentes apensadas referentes gestão com relação ao fundef os recursos devem ser destinados exclusivamente a gastos com pessoal transporte escolar e combustível embora os gastos com obras reformas nas escolas sejam considerados como manutenção e desenvolvimento do ensino nos termos do art 70 da ldb a decisão limita a aplicação dos recursos pessoal transporte escolar e combustível tendo em vista que o município não dispõe de fundo de previdência próprio o pagamento de aposentadorias não possui amparo legal ademais carece de documentos que comprovem o alegado pela defesa a constituição federal veda o aumento dos subsídios na mesma legislatura art 29 inciso vi da cf 88 sua sistemática remuneratória possui regulamentação específica no corpo do texto constitucional vez que além do princípio da anterioridade devem ser cumpridos os demais parâmetros estabelecidos nos artigos 29 e 29 a da cf 88 desse modo qualquer acréscimo remuneratório em afronta a esses comandos será considerado irregular as demais falhas constatadas no bojo da prestação de contas síntese de impropriedades quando analisadas conjuntamente ensejam a quantificação da multa aplicada;rendering of accounts management irregularity in expenses incurred with resources from fundef's court orders payment of pensions without its own pension fund non-payment with Eletrobrás pending accusations regarding management with respect to fundef the resources must be used exclusively for expenses with personnel, school transport and fuel, although expenditure on renovation works in schools are considered as maintenance and development of education under the terms of art 70 of the ldb. retirements do not have legal protection in addition to lack of documents proving the alleged by the defense the federal constitution prohibits the increase of subsidies in the same legislature art 29 item vi of cf 88 its remuneration system has specific regulation in the body of the constitutional text since in addition to the principle principle of anteriority, the other parameters established in articles 29 and 29 a of cf 88 must be complied with, thus any remuneration increase in violation of these commands will be considered irregular, the other failures found in the context of accountability synthesis of improprieties when analyzed together give rise to quantification of the fine applied;rendering of accounts management irregularity in disbursement incurred with resources from fundef ' s court orders payment of pensions without its own pension fund non - defrayal with Eletrobrás pending accusations regarding management with respect to fundef the resources must be used exclusively for expenses with personnel, school transport and fuel, although expenditure on renovation works in schools are conceive as maintenance and development of education under the terms of art 70 of the ldb. retirement do not have legal protection in improver to lack of documents proving the alleged by the defense the union constitution prohibits the increase of subsidies in the same legislature art 29 item vi of cf 88 its remuneration system has specific regulation in the body of the constitutional text since in addition to the principle principle of precedency, the other parameters established in articles 29 and 29 a of cf 88 must be complied with, thus any remuneration increase in violation of these commands will be considered irregular, the other failures found in the context of accountability synthesis of improprieties when psychoanalyse together give rise to quantification of the fine applied;prestação de contas irregularidade de gestão no desembolso incorrido com recursos do fundef ordena pagamento de pensão sem fundo de pensão próprio não custeio junto à Eletrobrás pendentes de denúncias de gestão com relação ao fundef os recursos devem ser utilizados exclusivamente para despesas com pessoal, transporte escolar e combustível, embora os gastos com obras de reforma nas escolas sejam concebidos como manutenção e desenvolvimento da educação nos termos do art. 70 da ldb. aposentadoria não tem amparo legal em melhoramento à falta de documentos que comprovem o alegado pela defesa a constituição do sindicato proíbe o aumento dos subsídios na mesma legislatura art 29 inciso vi da cf 88 seu sistema de remuneração tem regulamentação específica no corpo do texto constitucional pois além do princípio da precedência, devem ser observados os demais parâmetros estabelecidos nos artigos 29º e 29º-A do cf. síntese da responsabilização das impropriedades quando a psicanálise em conjunto dá origem à quantificação da multa aplicada;PRESTACAO DE CONTAS
prestação de contas câmara municipal de cristino castro exercício 2016 atraso no envio das prestações de contas mensais restos a pagar sem a correspondente disponibilidade finacneira no final do mandato pagamento de encargos legais decorrentes de juros e multas sobre o recolhimento de contribuições previdenciárias dos funcionários municipais recolhimento a menor das obrigações patronais variação indevida do subsídio dos vereadores 1 as prestações de contas devem ser enviadas na forma e no prazo estabelecido na legislação aplicável a ao caso sob pena de dificultar ou até inviabilizar a adequada análise das contas do respectivo ente nos termos do art 33 inciso ii da ce 89 emenda n 006 96 e art 3o da resolução tce no 39 2015 2 a existência de restos a pagar sem comprovação financeira viola ao art 42 da lei de responsabilidade fiscal além de afrontar o princípio do equilíbrio orçamentário 3 a orientação jurisprudencial n 11 que diz que caracteriza dano ao erário decorrente de ato de gestão ilegal ilegítimo ou antieconômico nos termos do art 122 iii da lei estadual n 5 888 09 o pagamento de multa juros e demais encargos de natureza compensatória em virtude do recolhimento intempestivo de contribuições previdenciárias 4 o recolhimento a menor das obrigações patronais viola o positivado no art 22 da lei 8 212 91;accountability municipal council of cristino castro fiscal year 2016 delay in sending monthly installments accounts payable without the corresponding financial availability at the end of the term payment of legal charges arising from interest and fines on the payment of social security contributions of municipal employees payment to minor of employers' obligations undue variation of the councilors' subsidy 1 the rendering of accounts must be sent in the form and within the period established in the applicable legislation to the case, under penalty of hindering or even making impossible the adequate analysis of the respective entity's accounts pursuant to art 33 item ii of ce 89 amendment no. 006 96 and art 3 of resolution tce no 39 2015 2 the existence of balances to be paid without financial proof violates art 42 of the fiscal responsibility law in addition to affronting the principle of budget balance 3 the jurisprudential guidance no 11 which says that it characterizes damage to the treasury resulting from a management act illegal illegitimate or uneconomic under the terms of art 122 iii of state law n. 5 888 09 the payment of fine, interest and other charges of a compensatory nature due to the untimely payment of social security contributions 4 the underpayment of employer obligations violates what is positive in art 22 of the law 8 212 91;accountability municipal council of cristino castro fiscal year 2016 delay in sending monthly installments accounts payable without the corresponding financial availability at the end of the term payment of legal charges arising from interest and fines on the payment of societal security contributions of municipal employees payment to minor of employers ' obligations undue variation of the councilors ' subsidy 1 the rendering of accounts must be sent in the form and within the period established in the applicable legislation to the case, nether penalty of hindering or even making impossible the adequate analysis of the respective entity ' s accounts pursuant to art 33 item ii of ce 89 amendment no. 006 96 and art 3 of resolution tce no 39 2015 2 the existence of balances to be paid without fiscal proof violates art 42 of the fiscal responsibility law in addition to affronting the principle of budget balance 3 the jurisprudential guidance no 11 which says that information technology characterizes scathe to the treasury resulting from a management bit illegal illegitimate or uneconomic under the terms of art 122 iii of state law n. 5 888 09 the payment of fine, interest and other charges of a compensatory nature due to the untimely payment of social security contributions 4 the underpayment of employer obligations violates what is positive in art 22 of the law 8 212 91;prestação de contas câmara municipal de cristino castro exercício 2016 atraso no envio das contas a pagar das parcelas mensais sem a correspondente disponibilidade financeira no final do prazo pagamento dos encargos legais decorrentes de juros e multas incidentes no pagamento de contribuições previdenciárias de funcionários municipais pagamento a menores de obrigações patronais variação indevida do subsídio de vereadores 1 a prestação de contas deverá ser encaminhada na forma e no prazo estabelecido na legislação aplicável ao caso, sob pena de dificultar ou mesmo impossibilitar a adequada análise da entidade respectiva ' s contas de acordo com o art. 33, inciso ii, da alteração nº 89, do art. 006 96 e art. 3 da resolução tce nº 39 2015 2 a existência de saldos a pagar sem comprovação fiscal viola o art. 42 da lei de responsabilidade fiscal além de afrontar o princípio do equilíbrio orçamentário 3 a orientação jurisprudencial nº 11 que diz que tecnologia da informação caracteriza derramamento para o tesouro decorrente de gestão pouco ilegítima, ilegítima ou antieconômica, nos termos do art. 122 iii da lei estadual n. 5 888 09 o pagamento de multa, juros e outros encargos de natureza compensatória por inadimplência de contribuições previdenciárias 4 o pagamento a menor de obrigações patronais viola o positivo do art. 22 da lei 8 212 91;PRESTACAO DE CONTAS
