ementa;ementa_em_ingles;nova_ementa_em_ingles;nova_ementa;assunto_agrupado
agravo regimental insuficiência de documentos requisito de caráter subjetivo dos três requisitos presentes no art 440 do ri tce pi para o recebimento do pedido de revisão a insuficiência de documentos na qual se tenha fundado a decisão recorrida é hoje o que apresenta um caráter mais subjetivo antes era muito comum nesta corte de contas a defesa se utilizar do requisito da superveniência de documentos novos no entanto o tribunal de forma objetiva já firmou entendimento e definiu as balizas para que se chegue a uma conclusão acerca de uma eventual documentação apresentada nos autos se esta se caracteriza como documentos novos ou não por outro lado no presente caso estamos diante da alegação de insuficiência de documentos em que se tenha fundado a decisão recorrida que diferentemente se mostra como um requisito de caráter bastante subjetivo;regulatory appeal insufficiency of documents requirement of a subjective nature of the three requirements present in art 440 of the ri tce pi for the receipt of the request for review the insufficiency of documents on which the appealed decision was based is today what presents a more subjective character before it was It is very common in this court of accounts for the defense to use the requirement of supervenience of new documents, however the court has objectively signed an understanding and defined the guidelines so that a conclusion can be reached about any documentation presented in the case records if it is characterized as new documents or not, on the other hand, in the present case, we are faced with the allegation of insufficient documents on which the appealed decision was based, which, on the other hand, appears as a very subjective requirement.;regulatory appeal insufficiency of documents requirement of a subjective nature of the three requirements present in art 440 of the ri tce pi for the receipt of the request for review the insufficiency of documents on which the appealed decision was based be today what presents a more subjective character before it was Information technology is very common in this court of accounts for the defense to use the requirement of supervenience of new documents, however the court has objectively signed an intellect and defined the guidelines so that a conclusion can be reached astir any documentation presented in the display case records if it is characterized as new documents or not, on the other hand, in the present display case, we are faced with the allegation of insufficient documents on which the appealed decision was based, which, on the other hand, appears as a very subjective requirement.;recurso normativo insuficiência de documentos exigência de natureza subjetiva dos três requisitos presentes no art. Antes de ser A tecnologia da informação é muito comum neste tribunal de contas para que a defesa utilize a exigência de superveniência de novos documentos, porém o tribunal tem objetivamente firmado um intelecto e definido as diretrizes para que se possa chegar a uma conclusão a partir de qualquer documentação apresentada em os autos se caracterizam como documentos novos ou não, por outro lado, na presente vitrine, deparamo-nos com a alegação de insuficiência de documentos em que se baseou a decisão recorrida, o que, por outro lado, aparece como uma exigência muito subjetiva.;PROCESSUAL
denúncia supostas irregularidades em procedimento licitatório cancelamento do certame arquivamento encontra se apensada prestação de contas denúncia noticiando supostas irregularidades no âmbito do procedimento licitatório concorrências n 005 2015 observou se que o referido procedimento foi cancelado indicando a perda do objeto da mencionada denúncia;denunciation alleged irregularities in the bidding procedure cancellation of the bidding process filing is attached the rendering of accounts denouncement reporting alleged irregularities in the scope of the bidding procedure bids n. 005 2015 it was observed that the referred procedure was canceled indicating the loss of the object of the mentioned denunciation;denunciation aver irregularities in the bidding procedure cancellation of the bidding process filing is attached the rendering of accounts denouncement reporting alleged irregularities in the scope of the bidding subroutine bids n. 005 2015 information technology was observed that the referred procedure was canceled indicating the loss of the object of the mentioned denunciation;A denúncia apura irregularidades no procedimento licitatório o cancelamento do processo licitatório está anexado à denúncia de prestação de contas relatando supostas irregularidades no âmbito das licitações da sub-rotina n. 005 2015 informática foi observado que o referido procedimento foi cancelado indicando a perda do objeto da referida denúncia;PROCESSUAL
processual falhas de natureza formal não conhecimento o pedido de revisão além de não configurar nova oportunidade para rediscutir critérios de julgamento também não é meio idôneo para sanar as lacunas probatórias ou as eventuais imperfeições da linha de defesa utilizada mormente porque o meio adequado para tanto seria o recurso de reconsideração;procedural failures of a formal nature not knowing the review request, in addition to not setting a new opportunity to re-discuss judgment criteria, it is also not a suitable means to remedy evidential gaps or any imperfections in the line of defense used, mainly because the appropriate means for this would be the reconsideration feature;procedural failures of a schematic nature not knowing the review request, in addition to not setting a new chance to re - discus judgment criteria, it is as well not a suitable means to remediate evidentiary gaps or any imperfections in the line of defense used, mainly because the appropriate means for this would be the reconsideration feature;falhas processuais de natureza esquemática o desconhecimento do pedido de revisão, além de não constituir uma nova oportunidade para rediscutir critérios de julgamento, também não é um meio adequado para remediar lacunas probatórias ou eventuais imperfeições na linha de defesa utilizada, principalmente porque o meio apropriado para isso seria o recurso de reconsideração;PROCESSUAL
ementa processual pedido de arquivamento de tomada de contas especial impossibilidade o regimento interno do tce pi em seu artigo 412 determina que não caberá recurso de decisão que determinar a instauração de tomada de contas inclusive especial;procedural summary request for archiving special account-taking impossibility the tce pi's internal regulation in its article 412 determines that there will be no appeal for a decision that determines the establishment of account-taking, including special;adjective succinct request for archiving exceptional account - taking impossibility the tce private investigator ' s internal regulation in it clause 412 determines that there will be no appeal for a decision that determines the formation of account - taking, including special;adjetivo sucinto pedido de arquivamento de conta excepcional - impossibilidade de tomar o regulamento interno do investigador privado em sua cláusula 412 determina que não caberá recurso de decisão que determine a constituição de conta - contábil, inclusive especial;PROCESSUAL
consulta regimento interno do tribunal de contas caso concreto impossibilidade o tribunal não conhecerá de consulta formulada em desacordo com as disposições do artigo anterior ou que verse apenas sobre caso concreto sendo liminarmente arquivada a consulta que versar sobre dúvida quanto interpretação e aplicação da legislação em caso concreto obriga ao consulente demonstrar e fundamentar o relevante interesse público da matéria e somente será recebida mediante decisão fundamentada do relator sendo que a decisão proferida pelo tribunal será sempre em tese;consultation of the internal regulations of the court of auditors concrete case impossibility the court will not hear any consultation made in disagreement with the provisions of the previous article or that only deals with a specific case, and the consultation that deals with doubt about the interpretation and application of the legislation in a specific case will be immediately filed obliges the consultant to demonstrate and substantiate the relevant public interest in the matter and will only be received upon a reasoned decision by the rapporteur, and the decision rendered by the court will always be based on thesis;consultation of the internal regulations of the court of auditors concrete case impossibleness the court will not hear any consultation made in disagreement with the provender of the previous article operating room that only deals with a specific case, and the consultation that deals with doubt about the interpretation and application of the legislation in a specific case bequeath be immediately filed obliges the consultant to demonstrate and substantiate the relevant public pursuit in the matter and will only be received upon a reasoned decision by the rapporteur, and the decision rendered by the court will always be based on dissertation;consulta do regulamento interno do tribunal de contas caso concreto impossibilidade o tribunal não ouvirá qualquer consulta feita em desacordo com o dispositivo do artigo anterior sala de cirurgia que apenas trata de um caso concreto, e a consulta que trata de dúvida sobre a interpretação e a aplicação da legislação em caso específico legado imediatamente obriga o consultor a demonstrar e fundamentar o pleito público pertinente na matéria e somente será recebido mediante decisão fundamentada do relator, sendo que a decisão proferida pelo juízo será sempre baseado na dissertação;PROCESSUAL
ementa processual inexigibilidade de licitação recursos federais incompetência do tce arquivamento a transferência dos recursos em questão é disciplinada pela resolução n 48 de 2 10 2012 me logo a presente denúncia deverá ser apreciada pelos órgãos de controle federal não envio ao tcu em razão da existência de denúncia idêntica;procedural summary unenforceability of bidding federal resources incompetence of the tce archiving the transfer of the resources in question is regulated by resolution n. 48 of 2 10 2012 and soon this complaint must be considered by the federal control bodies not being sent to tcu due to the existence of the complaint identical;procedural summary unenforceability of command federal resources incompetence of the trichloroethane archive the transfer of the resources in question be regulated by resolution n. 48 of 2 x 2012 and soon this complaint must be considered by the federal control bodies not being sent to tcu imputable to the existence of the complaint identical;sumária processual inexigibilidade de comando de recursos federais incompetência do arquivo de tricloroetano a transferência dos recursos em questão será regulamentada pela resolução n. 48 de 2 x 2012 e em breve esta reclamação deverá ser apreciada pelos órgãos de controle federal não sendo encaminhada ao tcu imputável a existência de reclamação idêntica;PROCESSUAL
ementa processual pedido de ingresso de terceiro interessado em processo interpretação do artigo 244 do ritce pi provimento o artigo 244 do regimento interno que fundamentou a negativa do pedido e ausência de retratação por parte do relator não faz referência quanto inclusão do processo em pauta se será para julgamento de mérito ou para decidir qualquer outro incidente processual de modo que decidiu o plenário ser razoável a interpretação de que o ingresso de interessado somente deve ser rejeitado quando o processo estiver pautado para julgamento do mérito;procedural summary request for entry of a third party interested in the proceeding interpretation of article 244 of the ritce pi granting article 244 of the internal regulations that justified the denial of the request and the absence of retraction by the rapporteur does not mention how much inclusion of the case in question will be for judgment on the merits or to decide any other procedural incident so that the plenary decided that the interpretation that the interested party's entry should only be rejected when the process is based on judgment of the merits is reasonable.;procedural summary request for entrance of a third party interested in the proceeding interpretation of article 244 of the ritce pi grant article 244 of the internal regulations that justified the denial of the request and the absence of retraction by the rapporteur does not cite how much inclusion of the case in question will be for judgment on the merit or to decide any other procedural incident so that the plenary decided that the rendering that the interested party ' s entry should but be rejected when the process is found on judgment of the merits is reasonable.;processo sumário de pedido de ingresso de terceiro interessado no processo de interpretação do art. 244 do Ritce pi conceder art. 244 do regimento interno que justificou o indeferimento do pedido e a ausência de retratação por parte do relator não cita quanto inclusão de o caso em questão será para julgamento de mérito ou para decisão de qualquer outro incidente processual de forma que o plenário decidiu que a declaração de que o ingresso do interessado deve ser rejeitado quando o processo se encontra em julgamento de mérito é razoável.;PROCESSUAL
ementa débito junto agespisa adimplência posterior repercussão positiva saneamento da ocorrência o débito do município junto agespisa foi preponderante para o julgamento irregular das contas de gestão na prestação de contas o posterior pagamento do débito sana a ocorrência e proporciona uma medida menos gravosa;menu debt with agespisa later payment positive repercussion remedying the occurrence the municipality's debt with agespisa was preponderant for the irregular judgment of the management accounts in the rendering of accounts, the subsequent payment of the debt clears the occurrence and provides a less onerous measure;menu debt with agespisa later defrayment incontrovertible repercussion remedying the occurrence the municipality ' s debt with agespisa was preponderant for the irregular judgment of the direction accounts in the interlingual rendition of invoice, the subsequent requital of the debt clear the occurrent and provides a less onerous measure;dívida menu com idadespisa custeio posterior incontestável repercussão sanando a ocorrência a dívida do município com idadespisa foi preponderante para o julgamento irregular das contas da direção na entrega interlingual de fatura, a posterior retribuição da dívida apura o ocorrido e prevê uma medida menos onerosa;PROCESSUAL
ementa : pessoal exoneração de controladora interna do município antes do final do mandato descumprimento do art 90 1 e 2 da constituição estadual existência de decisão judicial determinando a exoneração da controladora judicilaização da questão impossibilidade de nova análise pelo tribunal de contas o mandato do controlador interno é de três anos nos termos do art 90 1 da constituição estadual a exoneração do controlador interno antes do término do mandato deve ser precedida de regular processo administrativo como determina o art 90 2 da constituição estadual a permanência ou não de servidor no cargo de controlador interno do município não pode mais ser analisada no âmbito do tribunal de contas se existe uma decisão judicial pela exoneração do mesmo verificada a inexistência nos autos processuais da realização de processo administrativo para a destituição do cargo de controlador a legalidade ou não da exoneração assim como a sua permanência ou não no cargo fica cargo do poder judiciário uma vez que a matéria foi judicializada;summary : personnel exoneration of the municipality's internal controller before the end of the term of office non-compliance with art 90 1 and 2 of the state constitution existence of a court decision determining the controller's exoneration judicial review of the issue impossibility of further analysis by the audit court the internal controller's mandate is of three years under the terms of art 90 1 of the state constitution, the dismissal of the internal controller before the end of the term of office must be preceded by a regular administrative process, as determined by art 90 2 of the state constitution, the permanence or not of a civil servant in the position of internal controller of the municipality can no longer be analyzed within the scope of the audit court if there is a court decision for its dismissal, verified the non-existence in the procedural records of the carrying out of an administrative process for the removal of the controller's position, the legality or not of the dismissal as well as its permanence or not in the position, it is the responsibility of the judiciary. io once the matter was prosecuted;summary: personnel exoneration of the municipality ' s internal controller before the end of the term of office non - compliance with art 90 1 and 2 of the state constitution existence of a court decision determining the controller ' s exoneration juridic review of the issue impossibility of further analytic thinking by the audit court the internal controller ' s mandate is of three years under the terms of art 90 1 of the state constitution, the dismissal of the internal controller before the end of the term of office must be preceded by a regular administrative process, as determined by art 90 2 of the state constitution, the permanence or not of a civil servant in the position of internal controller of the municipality can no longer be analyzed within the scope of the audit court if at that place is a court decisiveness for it dismissal, verified the non - existence in the procedural records of the carrying out of an administrative process for the removal of the controller ' s position, the legality or non of the dismissal as well as its permanence or non in the position, it is the province of the judiciary. io once the matter was prosecuted;resumo: exoneração pessoal do controlador interno do município antes do final do mandato. Inobservância do art. 90 1 e 2 da constituição estadual existência de decisão judicial determinando exoneração do controlador revisão jurídica da questão impossibilidade de mais reflexão analítica do tribunal de contas o mandato do controlador interno é de três anos nos termos do art. 90 1 da constituição estadual, a destituição do controlador interno antes do final do mandato deve ser precedida de procedimento administrativo regular processo, conforme determinado pelo art. 90 2 da constituição estadual, a permanência ou não de servidor no cargo de controlador interno do município não pode mais ser analisada no âmbito do tribunal de contas se naquele local houver decisão judicial para o seu indeferimento, verificou-se a inexistência nos autos de tramitação de processo administrativo de destituição de cargo de controlador. Quanto à legalidade ou não da destituição, bem como à sua permanência ou não no cargo, compete ao Judiciário. uma vez que o assunto foi processado;PROCESSUAL
ementa : controle de constitucionalidade projeto de lei ausência de competência o controle de constitucionalidade pelas cortes de contas é possível mas somente controle de ato ou contrato administrativo no exercício da fiscalização e não controle da lei em abstrato conforme jurisprudência do stf;summary : review of constitutionality draft law lack of jurisdiction review of constitutionality by the courts of accounts is possible but only control of an administrative act or contract in the exercise of inspection and not control of the law in the abstract as per the jurisprudence of the stf;summary: review of constitutionality gulp legal philosophy lack of legal power review of constitutionality by the courts of accounts is possible but only control of an administrative enactment surgery contract in the exercise of inspection and not control of the law in the abstract as per the jurisprudence of the stf;resumo: revisão da constitucionalidade gulp filosofia jurídica falta de poder legal revisão da constitucionalidade pelos tribunais de contas é possível, mas apenas o controle de um contrato de cirurgia de promulgação administrativa no exercício da fiscalização e não o controle da lei em abstrato conforme a jurisprudência de o stf;PROCESSUAL
ementa processual não cumprimento de decisão que determinou a instauração de processo de tomada de contas especial o descumprimento reiterado de determinações do tribunal de contas do estado do piauí enseja o julgamento de irregularidade das contas conforme art 123 da lei estadual n 5 888 09 o tribunal de contas poderá aplicar multa de até quinze mil unidades fiscais de referência do estado aos responsáveis por não atendimento no prazo fixado a diligência ou determinação do tribunal art 79 ii da lei n 5 888 09;procedural summary non-compliance with the decision that determined the initiation of a special accounting process the repeated non-compliance with determinations of the court of auditors of the state of piauí gives rise to the judgment of irregularity of the accounts according to art 123 of state law no. 5 888 09 the court of accounts may apply a fine of up to fifteen thousand state reference tax units to those responsible for non-compliance within the period established by the diligence or determination of the court art 79 ii of law n. 5 888 09;adjective summary non - compliance with the decision that determined the initiation of a special accounting appendage the repeated non - compliance with determinations of the court of auditors of the state of piauí gives wage increase to the judgment of irregularity of the account consort to art 123 of state law no. 5 888 09 the court of accounts may apply a fine of up to fifteen thousand state reference tax units to those responsible for non - compliance within the period established by the diligence operating theatre determination of the court art 79 ii of law n. 5 888 09;adjetivo sumário descumprimento de decisão que determinou a instauração de autuação contábil especial o reiterado descumprimento de determinações do Tribunal de Contas do estado de piauí dá agravamento ao julgamento de irregularidade de conta consorciada ao art. 123 do art. lei estadual no. 5 888 09 o tribunal de contas poderá aplicar multa de até quinze mil unidades tributárias estaduais aos responsáveis ​​pelo descumprimento no prazo estabelecido pela determinação do teatro de diligência do juízo art. 79 ii da lei n. 5 888 09;PROCESSUAL
ementa : processual denúncia de irregularidades nas contratações ausência dos requisitos de admissibilidade não conhecimento arquivamento da denúncia a falta das cópias de documentação de identificação acerca da legitimidade do denunciante proporciona a não admissibilidade da denúncia;summary : procedural complaint of irregularities in hiring absence of admissibility requirements not knowing filing the complaint the lack of copies of identification documentation about the legitimacy of the complainant causes the inadmissibility of the complaint;summary: adjective ill of irregularities in hiring absence seizure of admissibility requirements not get it on file the charge the lack of copies of identification support astir the legitimacy of the complainant make the inadmissibility of the complaint;resumo: adjetivo mal de irregularidades na contratação falta apreensão de requisitos de admissibilidade não entrar no processo a cobrança a falta de cópias de comprovação de identificação quanto à legitimidade do reclamante fazem a inadmissibilidade da reclamação;PROCESSUAL
